{
  "id": "adb4c26c-c183-5fb3-ac59-6174c5bfb13a",
  "version": 1,
  "level": 2,
  "weight": 4,
  "incident_type_code": "13020100",
  "target_service_id": "104",
  "card": {
    "number": "73130005",
    "incident_type_code": "13020100",
    "caller_name": "Трунов Олег Егорович",
    "phone_aon": "+79000003103",
    "phone_provided": "",
    "phone_scene": "",
    "address": {
      "city": "Москва",
      "okrug": "",
      "district": "",
      "street": "улица Вавилова",
      "house": "81",
      "building": "1",
      "apartment": "5"
    },
    "description": "Свист от газовой трубы в квартире, на кухне. Скорая не требуется. Подъезд 1, этаж 2, код 5В.",
    "tags": [],
    "victims": false,
    "ambulance_refused": false,
    "blocked_people": false,
    "emergency": false,
    "incident_class": "Запах бытового газа в кухне",
    "service_ids": [
      "101",
      "104"
    ]
  },
  "reference": {
    "expected_flow": [
      "received",
      "accepted",
      "responding",
      "completed"
    ],
    "required_fields": [
      "service_number",
      "comment"
    ],
    "expected_service_ids": [
      "104"
    ],
    "expected_address": {
      "city": "Москва",
      "okrug": "",
      "district": "",
      "street": "улица Вавилова",
      "house": "81",
      "building": "1",
      "apartment": "5"
    },
    "expected_call": {
      "required": true,
      "service_id": "104",
      "phone_ext": "104",
      "before_s": 180
    },
    "expected_comment": "Принята. Свист от газовой трубы на кухне, пострадавших нет. Москва, улица Вавилова, д. 81, корп. 1, кв. 5, подъезд 1, этаж 2. Направлена аварийная бригада."
  },
  "complications": [],
  "origin": "imported",
  "status": "draft",
  "teacher_comment": "Билет 31, задача 3 (стр. 31 PDF заказчика). Эталон — учебная разметка команды по памятке ДДС и классификатору 046_24; преподавателем не проверен. Телефон заявителя заменён учебным."
}
